<!DOCTYPE Preview SYSTEM "../../project.dtd" [
        <!ENTITY prm_pv_common_params  SYSTEM "prm_pv_common_params.xml.txt">
        ]>

<Preview type="DATA_VIEW" id="prev_band_3">
    <Constraints>
        <Condition fieldDefId="band" value="3"/>
    </Constraints>

    <QueryId>
        wiseQuery_1b,wiseQuery_1b_up,wiseQuery_3a,wiseQuery_3a_up,wiseQuery_3o,wiseQuery_3o_up
    </QueryId>
    <EventWorkerId>target</EventWorkerId>
    <EventWorkerId>diff_spikes_3,halos_3,ghosts_3,latents_3</EventWorkerId>
    <Title>Preview 3</Title>
    &prm_pv_common_params;
    <Param key="ColorPreferenceKey" value="UseMetaTag:ProductLevel:1b=WISE-Band3-L1,Default=WISE-Band3-L3"/>
    <Param key="ExtraParams" value="band=3"/>
    <Param key="NoPreviewConditions" value="image_set=2"/>
    <Param key="Title" value="WISE Band 3"/>
</Preview>

