<!DOCTYPE EnumString SYSTEM "../../project.dtd">

<EnumString orientation="horizontal">
    <Name>artFiles</Name>
    <Title>Download Ancillary Files:</Title>
    <PreferWidth>400</PreferWidth>
    <Mask>[CHECKBOX]</Mask>
    <Default>_none_</Default>
    <NullAllowed/>
    <ShortDescription>Download Ancillary Files</ShortDescription>
    <EnumValue id="M">
        <Title>Mask</Title>
    </EnumValue>
    <EnumValue id="U">
        <Title>Uncertainty</Title>
    </EnumValue>
    <EnumValue id="D">
        <Title>Diffraction Spikes</Title>
    </EnumValue>
    <EnumValue id="H">
        <Title>Halos</Title>
    </EnumValue>
    <EnumValue id="O">
        <Title>Optical Ghosts</Title>
    </EnumValue>
    <EnumValue id="P">
        <Title>Latents</Title>
    </EnumValue>
</EnumString>
