<!DOCTYPE DEGREE SYSTEM "../../project.dtd">

<DEGREE units="arcsec">
    <Name>subsize</Name>
    <Title>Return Image Size (leave blank for full images)</Title>
    <Default>600</Default>
    <PreferWidth>16</PreferWidth>
    <ShortDescription>Specifies the size of the desired L1b or Atlas image cutout. Omitting this constraint will result in visualization/return of entire L1b/Atlas images.

In multi-input mode, this takes effect only for input tables without a subsize column.</ShortDescription>
    <ErrorDescription>Invalid entry!</ErrorDescription>
    <Min>1</Min>
    <Max>7200</Max>
    <NullAllowed/>
</DEGREE>
