<!DOCTYPE FieldGroup SYSTEM "../../project.dtd">

<FieldGroup xid="dpLevel_1b" labelWidth="140">
    <EnumString orientation="horizontal">
        <ID>dpLevel_1b</ID>
        <Name>dpLevel</Name>
        <Title>Data Product Level:</Title>
        <PreferWidth>300</PreferWidth>
        <Mask>[RADIO]</Mask>
        <Default>1b</Default>
        <ShortDescription>Data Product Level</ShortDescription>
        <ErrorDescription>Select at least one product!</ErrorDescription>
        <EnumValue id="1b">
            <Title>Single Exposure</Title>
        </EnumValue>
    </EnumString>
</FieldGroup>
