<!DOCTYPE Preview SYSTEM "../../project.dtd" [
        <!ENTITY prm_pv_common_params  SYSTEM "prm_pv_common_params.xml.txt">
        ]>

<Preview type="DATA_VIEW" id="prev_band_2">
    <Constraints>
        <Condition fieldDefId="band" value="2"/>
    </Constraints>

    <QueryId>wiseMOSQuery_1b</QueryId>
    <EventWorkerId>targetMOS</EventWorkerId>
    <EventWorkerId>diff_spikes_2,halos_2,ghosts_2,latents_2</EventWorkerId>
    <Title>Preview 2</Title>

    &prm_pv_common_params;
    <Param key="ExtraParams" value="band=2"/>
    <Param key="Title" value="WISE Band 2"/>

    <!-- override params-->
    <Param key="ArgCols" value="scan_id,frame_num,ra_obj,dec_obj,image_set"/>
    <Param key="Stretch" value="zscale=true,Type=Linear"/>
    <Param key="ColorPreferenceKey" value="UseMetaTag:ProductLevel:1b=WISE-Band2-L1,Default=WISE-Band2-L3"/>
</Preview>
