<!DOCTYPE FieldGroup SYSTEM "../../project.dtd">

<FieldGroup xid="bandSelection" labelWidth="140">
    <EnumString>
        <ID>band_3</ID>
        <Name>band</Name>
        <Title>Return the following bands:</Title>
        <Mask>[CHECKBOX]</Mask>
        <Default>_all_</Default>
        <ShortDescription>Band Selection: W1=3.4μm, W2=4.6μm, W3=12μm</ShortDescription>
        <ErrorDescription>Please select at least one band.</ErrorDescription>
        <EnumValue id="1">
            <Title>W1</Title>
        </EnumValue>
        <EnumValue id="2">
            <Title>W2</Title>
        </EnumValue>
        <EnumValue id="3">
            <Title>W3</Title>
        </EnumValue>
    </EnumString>
</FieldGroup>
